{
  "version_ri": 2,
  "empreinte_physique": "sha256:000000000000000000000000000000000000000000000000000000000000000e",
  "sgbd": "postgres",
  "espace_de_noms": "App\\Entity",
  "entites": [
    {
      "nom": "Client",
      "table": {
        "nom": "client",
        "schema": "public"
      },
      "identifiant": {
        "proprietes": [
          "id"
        ],
        "strategie": "identite"
      },
      "proprietes": [
        {
          "nom": "id",
          "colonne": "id",
          "type_doctrine": "integer",
          "nullable": false,
          "origine": "contrainte"
        },
        {
          "nom": "statut",
          "colonne": "statut",
          "type_doctrine": "string",
          "nullable": false,
          "enumeration": "StatutClient",
          "commentaire": "Type énuméré natif : le cas le plus sûr",
          "origine": "contrainte"
        },
        {
          "nom": "canal",
          "colonne": "canal",
          "type_doctrine": "string",
          "nullable": false,
          "longueur": 20,
          "enumeration": "CanalDeVente",
          "commentaire": "Valeurs fermées par un CHECK",
          "origine": "contrainte"
        },
        {
          "nom": "actif",
          "colonne": "actif",
          "type_doctrine": "string",
          "nullable": false,
          "longueur": 1,
          "longueur_fixe": true,
          "enumeration": "OuiNon",
          "commentaire": "O/N : des cas nommés O et N n'apprendraient rien",
          "origine": "contrainte"
        },
        {
          "nom": "solde",
          "colonne": "solde",
          "type_doctrine": "decimal",
          "nullable": false,
          "precision": 12,
          "echelle": 2,
          "origine": "contrainte"
        }
      ],
      "origine": "nommage"
    },
    {
      "nom": "Commande",
      "table": {
        "nom": "commande",
        "schema": "public"
      },
      "identifiant": {
        "proprietes": [
          "id"
        ],
        "strategie": "identite"
      },
      "proprietes": [
        {
          "nom": "id",
          "colonne": "id",
          "type_doctrine": "integer",
          "nullable": false,
          "origine": "contrainte"
        },
        {
          "nom": "etat",
          "colonne": "etat",
          "type_doctrine": "string",
          "nullable": false,
          "longueur": 20,
          "origine": "contrainte"
        },
        {
          "nom": "motif",
          "colonne": "motif",
          "type_doctrine": "string",
          "nullable": true,
          "longueur": 60,
          "origine": "contrainte"
        }
      ],
      "commentaire": "Un CHECK portant sur deux colonnes ne décrit pas une énumération",
      "origine": "nommage"
    }
  ],
  "enumerations": [
    {
      "nom": "CanalDeVente",
      "type_support": "string",
      "cas": [
        {
          "nom": "Direct",
          "valeur": "DIRECT"
        },
        {
          "nom": "Partenaire",
          "valeur": "PARTENAIRE"
        },
        {
          "nom": "Web",
          "valeur": "WEB"
        }
      ],
      "origine": "decision"
    },
    {
      "nom": "OuiNon",
      "type_support": "string",
      "cas": [
        {
          "nom": "Non",
          "valeur": "N"
        },
        {
          "nom": "Oui",
          "valeur": "O"
        }
      ],
      "origine": "decision"
    },
    {
      "nom": "StatutClient",
      "type_support": "string",
      "cas": [
        {
          "nom": "Prospect",
          "valeur": "PROSPECT"
        },
        {
          "nom": "Actif",
          "valeur": "ACTIF"
        },
        {
          "nom": "Suspendu",
          "valeur": "SUSPENDU"
        },
        {
          "nom": "Radie",
          "valeur": "RADIE"
        }
      ],
      "origine": "contrainte"
    }
  ]
}
