{
  "version_ri": 2,
  "empreinte_physique": "sha256:000000000000000000000000000000000000000000000000000000000000000b",
  "sgbd": "postgres",
  "espace_de_noms": "App\\Entity",
  "entites": [
    {
      "nom": "Etiquette",
      "table": {
        "nom": "etiquette",
        "schema": "public"
      },
      "identifiant": {
        "proprietes": [
          "id"
        ],
        "strategie": "identite"
      },
      "proprietes": [
        {
          "nom": "id",
          "colonne": "id",
          "type_doctrine": "integer",
          "nullable": false,
          "origine": "contrainte"
        }
      ],
      "origine": "nommage"
    },
    {
      "nom": "Commande",
      "table": {
        "nom": "commande",
        "schema": "public"
      },
      "identifiant": {
        "proprietes": [
          "id"
        ],
        "strategie": "identite"
      },
      "proprietes": [
        {
          "nom": "id",
          "colonne": "id",
          "type_doctrine": "integer",
          "nullable": false,
          "origine": "contrainte"
        },
        {
          "nom": "auditId",
          "colonne": "audit_id",
          "type_doctrine": "integer",
          "nullable": true,
          "origine": "contrainte"
        }
      ],
      "origine": "nommage"
    }
  ],
  "avertissements": [
    {
      "code": "table_ignoree",
      "cible": "public.audit",
      "message": "table écartée par une décision",
      "resolution": "ignoree",
      "confiance": 1
    },
    {
      "code": "cible_hors_portee",
      "cible": "public.commande.audit_id",
      "message": "la clé étrangère désigne public.audit, absente du calque ; colonne laissée en propriété",
      "resolution": "aucune",
      "confiance": 1
    },
    {
      "code": "cible_hors_portee",
      "cible": "public.commande_audit",
      "message": "table de jointure dont une extrémité est absente du calque, association non générée",
      "resolution": "aucune",
      "confiance": 1
    }
  ]
}
