{
  "version_ri": 2,
  "empreinte_physique": "sha256:0000000000000000000000000000000000000000000000000000000000000001",
  "sgbd": "postgres",
  "espace_de_noms": "App\\Entity",
  "entites": [
    {
      "nom": "Client",
      "table": {
        "nom": "client",
        "schema": "public"
      },
      "identifiant": {
        "proprietes": [
          "id"
        ],
        "strategie": "identite"
      },
      "proprietes": [
        {
          "nom": "id",
          "colonne": "id",
          "type_doctrine": "integer",
          "nullable": false,
          "origine": "contrainte"
        },
        {
          "nom": "raisonSociale",
          "colonne": "raison_sociale",
          "type_doctrine": "string",
          "nullable": false,
          "longueur": 120,
          "commentaire": "Dénomination légale",
          "origine": "contrainte"
        },
        {
          "nom": "siret",
          "colonne": "siret",
          "type_doctrine": "string",
          "nullable": true,
          "longueur": 14,
          "longueur_fixe": true,
          "unique": true,
          "origine": "contrainte"
        },
        {
          "nom": "chiffreAffaires",
          "colonne": "chiffre_affaires",
          "type_doctrine": "decimal",
          "nullable": true,
          "precision": 12,
          "echelle": 2,
          "origine": "contrainte"
        },
        {
          "nom": "actif",
          "colonne": "actif",
          "type_doctrine": "boolean",
          "nullable": false,
          "defaut": "true",
          "origine": "contrainte"
        },
        {
          "nom": "creeLe",
          "colonne": "cree_le",
          "type_doctrine": "datetimetz_immutable",
          "nullable": false,
          "defaut_expression": "horodatage_courant",
          "origine": "contrainte"
        }
      ],
      "index": [
        {
          "nom": "client_raison_sociale_idx",
          "colonnes": [
            "raison_sociale"
          ],
          "unique": false
        },
        {
          "nom": "client_siret_key",
          "colonnes": [
            "siret"
          ],
          "unique": true
        }
      ],
      "commentaire": "Fiche client",
      "origine": "nommage"
    }
  ]
}
