{
  "version_ri": 2,
  "empreinte_physique": "sha256:0000000000000000000000000000000000000000000000000000000000000007",
  "sgbd": "postgres",
  "espace_de_noms": "App\\Entity",
  "entites": [
    {
      "nom": "Categories",
      "table": {
        "nom": "categories",
        "schema": "public"
      },
      "identifiant": {
        "proprietes": [
          "id"
        ],
        "strategie": "assignee"
      },
      "proprietes": [
        {
          "nom": "id",
          "colonne": "id",
          "type_doctrine": "integer",
          "nullable": false,
          "origine": "contrainte"
        }
      ],
      "origine": "nommage"
    },
    {
      "nom": "Journaux",
      "table": {
        "nom": "journaux",
        "schema": "public"
      },
      "identifiant": {
        "proprietes": [
          "id"
        ],
        "strategie": "assignee"
      },
      "proprietes": [
        {
          "nom": "id",
          "colonne": "id",
          "type_doctrine": "integer",
          "nullable": false,
          "origine": "contrainte"
        }
      ],
      "origine": "nommage"
    },
    {
      "nom": "Bureaux",
      "table": {
        "nom": "bureaux",
        "schema": "public"
      },
      "identifiant": {
        "proprietes": [
          "id"
        ],
        "strategie": "assignee"
      },
      "proprietes": [
        {
          "nom": "id",
          "colonne": "id",
          "type_doctrine": "integer",
          "nullable": false,
          "origine": "contrainte"
        }
      ],
      "origine": "nommage"
    },
    {
      "nom": "BoitesAuxLettres",
      "table": {
        "nom": "boites_aux_lettres",
        "schema": "public"
      },
      "identifiant": {
        "proprietes": [
          "id"
        ],
        "strategie": "assignee"
      },
      "proprietes": [
        {
          "nom": "id",
          "colonne": "id",
          "type_doctrine": "integer",
          "nullable": false,
          "origine": "contrainte"
        }
      ],
      "origine": "nommage"
    },
    {
      "nom": "Adresses",
      "table": {
        "nom": "adresses",
        "schema": "public"
      },
      "identifiant": {
        "proprietes": [
          "id"
        ],
        "strategie": "assignee"
      },
      "proprietes": [
        {
          "nom": "id",
          "colonne": "id",
          "type_doctrine": "integer",
          "nullable": false,
          "origine": "contrainte"
        }
      ],
      "origine": "nommage"
    },
    {
      "nom": "Pays",
      "table": {
        "nom": "pays",
        "schema": "public"
      },
      "identifiant": {
        "proprietes": [
          "code"
        ],
        "strategie": "assignee"
      },
      "proprietes": [
        {
          "nom": "code",
          "colonne": "code",
          "type_doctrine": "string",
          "nullable": false,
          "longueur": 2,
          "longueur_fixe": true,
          "origine": "contrainte"
        }
      ],
      "origine": "nommage"
    },
    {
      "nom": "Status",
      "table": {
        "nom": "status",
        "schema": "public"
      },
      "identifiant": {
        "proprietes": [
          "code"
        ],
        "strategie": "assignee"
      },
      "proprietes": [
        {
          "nom": "code",
          "colonne": "code",
          "type_doctrine": "string",
          "nullable": false,
          "longueur": 16,
          "origine": "contrainte"
        }
      ],
      "origine": "nommage"
    },
    {
      "nom": "People",
      "table": {
        "nom": "people",
        "schema": "public"
      },
      "identifiant": {
        "proprietes": [
          "id"
        ],
        "strategie": "assignee"
      },
      "proprietes": [
        {
          "nom": "id",
          "colonne": "id",
          "type_doctrine": "integer",
          "nullable": false,
          "origine": "contrainte"
        }
      ],
      "origine": "nommage"
    },
    {
      "nom": "Boxes",
      "table": {
        "nom": "boxes",
        "schema": "public"
      },
      "identifiant": {
        "proprietes": [
          "id"
        ],
        "strategie": "assignee"
      },
      "proprietes": [
        {
          "nom": "id",
          "colonne": "id",
          "type_doctrine": "integer",
          "nullable": false,
          "origine": "contrainte"
        }
      ],
      "origine": "nommage"
    },
    {
      "nom": "Acces",
      "table": {
        "nom": "acces",
        "schema": "public"
      },
      "identifiant": {
        "proprietes": [
          "id"
        ],
        "strategie": "assignee"
      },
      "proprietes": [
        {
          "nom": "id",
          "colonne": "id",
          "type_doctrine": "integer",
          "nullable": false,
          "origine": "contrainte"
        }
      ],
      "origine": "nommage"
    },
    {
      "nom": "Client",
      "table": {
        "nom": "client",
        "schema": "public"
      },
      "identifiant": {
        "proprietes": [
          "id"
        ],
        "strategie": "assignee"
      },
      "proprietes": [
        {
          "nom": "id",
          "colonne": "id",
          "type_doctrine": "integer",
          "nullable": false,
          "origine": "contrainte"
        }
      ],
      "origine": "nommage"
    }
  ]
}
